company_name,slug,website,phone,city,region,services,emergency_service,brands_supported,notes,source_urls,tsbc_verified,tsbc_fsr_license,tsbc_gas_license,tsbc_electrical_license,tsbc_license_status,tsbc_enforcement_actions,tsbc_last_verified,ems_certified,strata_approved,cold_climate_pro
RPR Heating & Air Conditioning,rpr-heating-air-conditioning,https://www.rprheating.com,+1-250-492-3677,Penticton,Interior,heat_pumps,unknown,Daikin,"Service area: Penticton, South Okanagan, Similkameen. HPCN member; since 1979; TSBC licence LGA0205242; Daikin Master Group dealer; geothermal capability; ductless + ducted + fan coils + sheet metal; commercial and residential; 154 Ellis St Penticton BC V2A 4L5",,TRUE,,LGA0205242,,active,0,2026-02-21,FALSE,FALSE,FALSE
All Valley Heat Pumps & AC,all-valley-heat-pumps-ac,https://www.allvalleyheatpumps.com,+1-250-493-4822,Penticton,Interior,heat_pumps,unknown,Daikin,"Service area: Penticton, Summerland, Osoyoos. Owner-operated; Red Seal Refrigeration Mechanic; TECA certified; FortisBC Trade Ally; TSBC LEL0201557 + LGA0102887; Daikin dealer; 354 Scott Ave Penticton BC V2A 2J8",,TRUE,,LGA0102887,LEL0201557,active,0,2026-02-21,FALSE,FALSE,FALSE
Fehling's Sheet Metal Ltd.,fehlings-sheet-metal-ltd,https://www.fehlingssheetmetal.com,+1-250-492-8076,Penticton,Interior,heat_pumps,unknown,York,"Service area: Penticton, South Okanagan. Family-owned since 1984; York Certified Comfort Expert (CCE); FortisBC Trade Ally; TSBC LGA0003043; Red Seal journeyman technicians; 24/7 emergency; CHBA South Okanagan member; 560 Okanagan Ave E Penticton BC V2A 3K5",,TRUE,,LGA0003043,,active,0,2026-02-21,FALSE,FALSE,FALSE
Valleywide Climate Solutions Ltd.,valleywide-climate-solutions-ltd,https://valleywideltd.ca,+1-250-328-2115,Kaleden,Interior,heat_pumps,unknown,Multiple,"Service area: Penticton, Kaleden, Okanagan Falls, Oliver. HQ Kaleden (rural south of Penticton); BBB A+ (not accredited); since 2015; commercial + residential; refrigeration + walk-in cooler service; 434 Hwy 97 Kaleden BC V0H 1K0",,FALSE,,,,unknown,0,,FALSE,FALSE,FALSE
Sarsons Mechanical Services Ltd.,sarsons-mechanical-services-ltd,https://www.sarsonsmechanical.com,+1-250-497-8858,Okanagan Falls,Interior,heat_pumps,unknown,"Daikin, Amana","Service area: Okanagan Falls, Oliver, Penticton, Summerland, Osoyoos, Keremeos, Naramata. HQ Okanagan Falls; 30+ years; full Daikin lineup including Daikin VRV (commercial VRF); Amana Lifetime Replacement Warranty; 1-year labour warranty; 1101 Main St Okanagan Falls BC V0H 1R0",,FALSE,,,,unknown,0,,FALSE,FALSE,FALSE
Applewood Heating & Air Conditioning Ltd.,applewood-heating-air-conditioning-ltd,https://www.applewoodheating.net,+1-250-549-4777,Vernon,Interior,heat_pumps,unknown,Lennox,"Service area: Vernon, North Okanagan. Lennox Premier Dealer; family-owned since 1997; showroom with gas/propane/wood BBQs; full-service: heat pumps + furnaces + hot water + electrical; 8-1800 Kalamalka Lake Rd Vernon BC V1T 6V3",,FALSE,,,,unknown,0,,FALSE,FALSE,FALSE
Air Tech Plumbing Heating Cooling & Green Energy,air-tech-plumbing-heating-cooling-green-energy,https://www.airtechmechanical.ca,+1-250-542-7255,Vernon,Interior,heat_pumps,unknown,Lennox,"Service area: Vernon, Kelowna, West Kelowna, Kamloops. Lennox authorized dealer; HRAI member; since 2006; 4 BC Interior locations; full-scope: plumbing + HVAC + electrical + geothermal; 24/7; BBB; A-4315 25 Ave Vernon BC V1T 1P5",,FALSE,,,,unknown,0,,FALSE,FALSE,FALSE
Coldstream Mechanical,coldstream-mechanical,https://www.coldstreammech.com,+1-250-558-9134,Vernon,Interior,"heat_pumps, boilers",unknown,Mitsubishi,"Service area: Vernon, North Okanagan. Mitsubishi dealer; TSBC licence LGA0203359; family-owned since 2015; boiler + heat pump + plumbing; Vernon Chamber member; Top 30 Under 30 award winner; FortisBC + BC Hydro rebate specialist; CAUTION: no physical street address confirmed",,TRUE,,LGA0203359,,active,0,2026-02-21,FALSE,FALSE,FALSE
DBL J HVAC/R,dbl-j-hvac-r,https://www.dbljhvacr.com,+1-250-503-8154,Vernon,Interior,heat_pumps,unknown,Multiple,"Service area: Vernon, Armstrong, Enderby, Lake Country, Oyama. Owner-operated; Red Seal Refrigeration Mechanic journeyman; HVAC + refrigeration specialty; serves Lake Country to Enderby; 5-star reviews; 11905 Westside Rd Vernon BC V1H 2G6",,FALSE,,,,unknown,0,,FALSE,FALSE,FALSE
Proair Heating & Cooling,proair-heating-cooling,https://saproair.ca,+1-250-832-6911,Salmon Arm,Interior,heat_pumps,unknown,York,"Service area: Salmon Arm, Chase, Revelstoke, Shuswap. York Certified Comfort Expert (CCE) dealer; family-run since 2008; residential and commercial; serves Chase to Revelstoke; 100% satisfaction guarantee; 1481 10th Ave SW Salmon Arm BC V1E 1T2",,FALSE,,,,unknown,0,,FALSE,FALSE,FALSE
EcoFlow Plumbing and Heating,ecoflow-plumbing-and-heating,https://www.ecoflowbc.ca,+1-250-832-5846,Salmon Arm,Interior,heat_pumps,unknown,Multiple,"Service area: Salmon Arm, Vernon, Shuswap. BBB accredited; co-owners in trade since 2005; gas fitting + plumbing + HVAC; 24/7 emergency; locally owned and operated; 3061 18 Ave NE Salmon Arm BC V1E 4N7",,FALSE,,,,unknown,0,,FALSE,FALSE,FALSE
Home Comfort Centre,home-comfort-centre,https://www.homecomfortcentre.ca,+1-250-804-4328,Salmon Arm,Interior,"heat_pumps, boilers",unknown,Multiple,"Service area: Salmon Arm, Shuswap Region. Since 1998; Master Group dealer (Daikin/York/etc.); full-service: heat pumps + furnaces + boilers + radiant + fireplaces; 24/7 emergency; commercial and residential; 1860 10th Ave SW Salmon Arm BC V1E 4N2",,FALSE,,,,unknown,0,,FALSE,FALSE,FALSE
North Broadview Plumbing & Heating Ltd.,north-broadview-plumbing-heating-ltd,https://www.northbroadview.ca,+1-250-832-0255,Salmon Arm,Interior,"heat_pumps, boilers",unknown,Multiple,"Service area: Salmon Arm, Canoe, Shuswap, Revelstoke, Kamloops. BBB accredited; 20+ years; in-floor heating + boilers + heat pumps + plumbing; bonded gas fitting; after-hours service; 2120 70 St SE Salmon Arm BC V1E 1X4",,FALSE,,,,unknown,0,,FALSE,FALSE,FALSE
Bee's Knees Plumbing HVAC & Electrical,bees-knees-plumbing-hvac-electrical,https://www.beeskneesplumbingandheating.ca,+1-778-505-2547,Vernon,Interior,heat_pumps,unknown,Multiple,"Service area: Vernon, Kelowna, Salmon Arm, West Kelowna, Enderby, Fintry. BBB accredited; owner Kevin U. 18+ years in trades; Red Seal certified; plumbing + HVAC + electrical + gas fitting; 24/7; 3009 43rd Ave #5 Vernon BC V1T 3L4",,FALSE,,,,unknown,0,,FALSE,FALSE,FALSE