Company_Name,Phone,Website,Email,City,Province,Service_Area_Cities,Brands_Installed,Services,Google_Maps_Link,Notes,Verification_Status
All Valley Heat Pumps & AC,+1-250-493-4822,https://www.allvalleyheatpumps.com,,Penticton,BC,"Penticton, Summerland, Osoyoos",Daikin,Heat Pumps,https://www.google.com/maps/search/All+Valley+Heat+Pumps+354+Scott+Avenue+Penticton+BC,Owner-operated; Red Seal Refrigeration Mechanic; TECA certified; FortisBC Trade Ally; TSBC LEL0201557 + LGA0102887; Daikin dealer; 354 Scott Ave Penticton BC V2A 2J8,Verified_Website
Fehling's Sheet Metal Ltd.,+1-250-492-8076,https://www.fehlingssheetmetal.com,fehlings@shaw.ca,Penticton,BC,"Penticton, South Okanagan",York,Heat Pumps,https://www.google.com/maps/search/Fehlings+Sheet+Metal+560+Okanagan+Avenue+East+Penticton+BC,Family-owned since 1984; York Certified Comfort Expert (CCE); FortisBC Trade Ally; TSBC LGA0003043; Red Seal journeyman technicians; 24/7 emergency; CHBA South Okanagan member; 560 Okanagan Ave E Penticton BC V2A 3K5,Verified_Website
Valleywide Climate Solutions Ltd.,+1-250-328-2115,https://valleywideltd.ca,,Kaleden,BC,"Penticton, Kaleden, Okanagan Falls, Oliver",Multiple,Heat Pumps,https://www.google.com/maps/search/Valleywide+Climate+Solutions+434+Highway+97+Kaleden+BC,HQ Kaleden (rural south of Penticton); BBB A+ (not accredited); since 2015; commercial + residential; refrigeration + walk-in cooler service; 434 Hwy 97 Kaleden BC V0H 1K0,Verified_Website
Sarsons Mechanical Services Ltd.,+1-250-497-8858,https://www.sarsonsmechanical.com,,Okanagan Falls,BC,"Okanagan Falls, Oliver, Penticton, Summerland, Osoyoos, Keremeos, Naramata","Daikin, Amana","Heat Pumps, VRF",https://www.google.com/maps/search/Sarsons+Mechanical+1101+Main+Street+Okanagan+Falls+BC,HQ Okanagan Falls; 30+ years; full Daikin lineup including Daikin VRV (commercial VRF); Amana Lifetime Replacement Warranty; 1-year labour warranty; 1101 Main St Okanagan Falls BC V0H 1R0,Verified_Website
Applewood Heating & Air Conditioning Ltd.,+1-250-549-4777,https://www.applewoodheating.net,,Vernon,BC,"Vernon, North Okanagan",Lennox,Heat Pumps,https://www.google.com/maps/search/Applewood+Heating+Air+Conditioning+1800+Kalamalka+Lake+Road+Vernon+BC,Lennox Premier Dealer; family-owned since 1997; showroom with gas/propane/wood BBQs; full-service: heat pumps + furnaces + hot water + electrical; 8-1800 Kalamalka Lake Rd Vernon BC V1T 6V3,Verified_Website
Air Tech Plumbing Heating Cooling & Green Energy,+1-250-542-7255,https://www.airtechmechanical.ca,info@airtechmechanical.ca,Vernon,BC,"Vernon, Kelowna, West Kelowna, Kamloops",Lennox,Heat Pumps,https://www.google.com/maps/search/Air+Tech+Mechanical+4315+25th+Avenue+Vernon+BC,Lennox authorized dealer; HRAI member; since 2006; 4 BC Interior locations; full-scope: plumbing + HVAC + electrical + geothermal; 24/7; BBB; A-4315 25 Ave Vernon BC V1T 1P5,Verified_Website
Coldstream Mechanical,+1-250-558-9134,https://www.coldstreammech.com,info@coldstreammech.com,Vernon,BC,"Vernon, North Okanagan",Mitsubishi,"Heat Pumps, Hydronics",https://www.google.com/maps/search/Coldstream+Mechanical+Vernon+BC,Mitsubishi dealer; TSBC licence LGA0203359; family-owned since 2015; boiler + heat pump + plumbing; Vernon Chamber member; Top 30 Under 30 award winner; FortisBC + BC Hydro rebate specialist; CAUTION: no physical street address confirmed,Unverified
DBL J HVAC/R,+1-250-503-8154,https://www.dbljhvacr.com,,Vernon,BC,"Vernon, Armstrong, Enderby, Lake Country, Oyama",Multiple,Heat Pumps,https://www.google.com/maps/search/DBL+J+HVACR+11905+Westside+Road+Vernon+BC,Owner-operated; Red Seal Refrigeration Mechanic journeyman; HVAC + refrigeration specialty; serves Lake Country to Enderby; 5-star reviews; 11905 Westside Rd Vernon BC V1H 2G6,Verified_Website
Proair Heating & Cooling,+1-250-832-6911,https://saproair.ca,proair@saproair.ca,Salmon Arm,BC,"Salmon Arm, Chase, Revelstoke, Shuswap",York,Heat Pumps,https://www.google.com/maps/search/Proair+Heating+Cooling+1481+10th+Avenue+SW+Salmon+Arm+BC,York Certified Comfort Expert (CCE) dealer; family-run since 2008; residential and commercial; serves Chase to Revelstoke; 100% satisfaction guarantee; 1481 10th Ave SW Salmon Arm BC V1E 1T2,Verified_Website
EcoFlow Plumbing and Heating,+1-250-832-5846,https://www.ecoflowbc.ca,service@ecoflowbc.ca,Salmon Arm,BC,"Salmon Arm, Vernon, Shuswap",Multiple,Heat Pumps,https://www.google.com/maps/search/EcoFlow+Plumbing+Heating+3061+18th+Avenue+NE+Salmon+Arm+BC,BBB accredited; co-owners in trade since 2005; gas fitting + plumbing + HVAC; 24/7 emergency; locally owned and operated; 3061 18 Ave NE Salmon Arm BC V1E 4N7,Verified_Website
Home Comfort Centre,+1-250-804-4328,https://www.homecomfortcentre.ca,sahcc@telus.net,Salmon Arm,BC,"Salmon Arm, Shuswap Region",Multiple,"Heat Pumps, Hydronics",https://www.google.com/maps/search/Home+Comfort+Centre+1860+10th+Avenue+SW+Salmon+Arm+BC,Since 1998; Master Group dealer (Daikin/York/etc.); full-service: heat pumps + furnaces + boilers + radiant + fireplaces; 24/7 emergency; commercial and residential; 1860 10th Ave SW Salmon Arm BC V1E 4N2,Verified_Website
North Broadview Plumbing & Heating Ltd.,+1-250-832-0255,https://www.northbroadview.ca,,Salmon Arm,BC,"Salmon Arm, Canoe, Shuswap, Revelstoke, Kamloops",Multiple,"Heat Pumps, Hydronics",https://www.google.com/maps/search/North+Broadview+Plumbing+Heating+2120+70th+Street+SE+Salmon+Arm+BC,BBB accredited; 20+ years; in-floor heating + boilers + heat pumps + plumbing; bonded gas fitting; after-hours service; 2120 70 St SE Salmon Arm BC V1E 1X4,Verified_Website
Bee's Knees Plumbing HVAC & Electrical,+1-778-505-2547,https://www.beeskneesplumbingandheating.ca,,Vernon,BC,"Vernon, Kelowna, Salmon Arm, West Kelowna, Enderby, Fintry",Multiple,Heat Pumps,https://www.google.com/maps/search/Bees+Knees+Plumbing+HVAC+3009+43rd+Avenue+Vernon+BC,BBB accredited; owner Kevin U. 18+ years in trades; Red Seal certified; plumbing + HVAC + electrical + gas fitting; 24/7; 3009 43rd Ave #5 Vernon BC V1T 3L4,Verified_Website
